{
  "evidence_version": "1.0.0",
  "component": "governed-module-loader",
  "owner": "CHATGPT",
  "claimed_state": "BUILT",
  "reality": "IMPLEMENTED",
  "evidence": [
    {
      "kind": "IMPLEMENTATION_PATH",
      "locator": "moduleloader/loader.py",
      "resolved": true
    },
    {
      "kind": "CONTRACT_SCHEMA",
      "locator": "handoff/schemas/capability-request.schema.json",
      "resolved": true
    },
    {
      "kind": "TEST_NODE",
      "locator": "tests/unit/test_module_loader.py::test_detach_always_succeeds",
      "resolved": true
    }
  ],
  "external_effects": 0,
  "authority_minted": false,
  "gaps": [
    "Lifecycle activation records eligibility only; no module code was imported or executed.",
    "No closure registry or organ manifest was edited, so EXERCISED and PROVEN are not claimed.",
    "Persistence and crash recovery remain injected production integration responsibilities."
  ],
  "bundle_digest": "fe1556048a9ca60f5956388adb9ddb81cbf060491b1fc8f38c6e2892e42d2c0c"
}
